{
  "specversion": "1.0",
  "id": "evt_operation_job_101_terminal",
  "source": "urn:reference-client:production:generation-worker",
  "type": "com.signalops.ai.operation.terminal.v1",
  "subject": "operation/job_101",
  "time": "2026-08-23T04:31:00.000Z",
  "datacontenttype": "application/json",
  "dataschema": "https://signalops.cc/schemas/ai-telemetry/v1",
  "data": {
    "operation": {
      "id": "job_101",
      "kind": "video_generation",
      "logicalModelKey": "video.standard"
    },
    "outcome": {
      "status": "failed",
      "failure": {
        "category": "provider_timeout",
        "responsibility": "provider",
        "code": "provider_deadline_exceeded",
        "retryable": true
      }
    },
    "metrics": {
      "totalDurationMs": 180000,
      "attemptCount": 2
    },
    "resource": {
      "environment": "production",
      "service": "generation-worker"
    }
  }
}
